{
  "$schema": "https://json-schema.org/draft/2020-12/schema",
  "$id": "anchor://schemas/gemma3-chat-unbalanced-v2-teacher-alignment-heldout-receipt-v1",
  "type": "object",
  "additionalProperties": false,
  "required": [
    "schema_version",
    "decision",
    "content_read",
    "case_file_sha256",
    "manifest_sha256",
    "prebulk_receipt_sha256",
    "physical_mode",
    "checked_at"
  ],
  "properties": {
    "schema_version": {
      "const": "anchor.gemma3-chat-five-expert-qonly-unbalanced-v2.teacher-alignment.heldout-gate-receipt.v1"
    },
    "decision": {"const": "PASS"},
    "content_read": {"const": false},
    "case_file_sha256": {
      "const": "89c50fb201124e5d1df1ac9e1dd4308dfbee69605c56b0b4c20636a80cc46655"
    },
    "manifest_sha256": {
      "const": "1ac7240d700a67458dc713b66ff085f1e51795b26cdacff688063bc60af3194c"
    },
    "prebulk_receipt_sha256": {
      "const": "cf445089a94fd772ce1976560682e93d50a2d5b1d4c2503e441ac6058717d257"
    },
    "physical_mode": {
      "enum": ["clean_lf_checkout", "authenticated_readonly_overlay"]
    },
    "checked_at": {"type": "string", "format": "date-time"}
  }
}
